{
  "schema_version": 1,
  "registry_id": "walteur-default-gate-registry",
  "gates": [
    {
      "id": "build-contract-lint",
      "stage": "intake",
      "hardness": "detect_or_skip",
      "availability": "spec",
      "hook": "build-contract-lint.sh",
      "report": "walteur-kit/build-contract-report.json",
      "evidence": "Build contract is valid or explicitly not applicable."
    },
    {
      "id": "gate-registry-lint",
      "stage": "intake",
      "hardness": "detect_or_skip",
      "availability": "spec",
      "hook": "gate-registry-lint.sh",
      "report": "walteur-kit/gate-registry-report.json",
      "evidence": "Gate registry is valid and required gates are declared."
    },
    {
      "id": "estimate-gate",
      "stage": "plan",
      "hardness": "hard",
      "availability": "spec",
      "hook": "estimate-gate.sh",
      "report": "walteur-kit/estimate-report.json",
      "evidence": "Pre-build estimate exists, validates, and matches runtime budgets."
    },
    {
      "id": "current-stack-gate",
      "stage": "plan",
      "hardness": "hard",
      "availability": "spec",
      "hook": "current-stack-gate.sh",
      "report": "walteur-kit/current-stack-report.json",
      "evidence": "Run-date stack choices are checked against current official/source material with evidence."
    },
    {
      "id": "harness-state-lint",
      "stage": "verify",
      "hardness": "detect_or_skip",
      "availability": "spec",
      "hook": "harness-state-lint.sh",
      "report": "walteur-kit/harness-state-report.json",
      "evidence": "Runtime state is valid or explicitly not applicable."
    },
    {
      "id": "phase-gate",
      "stage": "verify",
      "hardness": "hard",
      "availability": "spec",
      "hook": "phase-gate.sh",
      "report": "walteur-kit/phase-gate-report.json",
      "evidence": "Phase order and prior-stage evidence are valid before advancement."
    },
    {
      "id": "evidence-gate",
      "stage": "verify",
      "hardness": "hard",
      "availability": "spec",
      "hook": "evidence-gate.sh",
      "report": "walteur-kit/evidence-gate-report.json",
      "evidence": "Referenced evidence exists and supports the gate or stage verdict it is used for."
    },
    {
      "id": "risk-acceptance-gate",
      "stage": "review",
      "hardness": "hard",
      "availability": "spec",
      "hook": "risk-acceptance-gate.sh",
      "report": "walteur-kit/risk-acceptance-report.json",
      "evidence": "Accepted risks and high-risk ship decisions have approved owner signoff with evidence."
    },
    {
      "id": "adr-gate",
      "stage": "review",
      "hardness": "detect_or_skip",
      "availability": "spec",
      "hook": "adr-gate.sh",
      "report": "walteur-kit/adr-report.json",
      "evidence": "All real forks are closed in debate/OPEN.json and any ADR records include decision, rationale, rejected alternatives, dissent, owner, and index evidence."
    },
    {
      "id": "prompt-refinement-gate",
      "stage": "plan",
      "hardness": "detect_or_skip",
      "availability": "spec",
      "hook": "prompt-refinement-gate.sh",
      "report": "walteur-kit/prompt-refinement-report.json",
      "evidence": "The raw user request is refined into an enterprise build brief with outcome, scope, acceptance criteria, routing, specialists, verification, and stop conditions."
    },
    {
      "id": "enterprise-blueprint-gate",
      "stage": "plan",
      "hardness": "detect_or_skip",
      "availability": "spec",
      "hook": "enterprise-blueprint-gate.sh",
      "report": "walteur-kit/enterprise-blueprint-report.json",
      "evidence": "The raw goal is upgraded into a concrete enterprise blueprint with users, jobs, artifacts, surfaces, acceptance proof, trust, operations, cuts, and final delivery packet."
    },
    {
      "id": "delivery-orchestration-gate",
      "stage": "plan",
      "hardness": "detect_or_skip",
      "availability": "spec",
      "hook": "delivery-orchestration-gate.sh",
      "report": "walteur-kit/delivery-orchestration-report.json",
      "evidence": "Agent roster, SDLC stage gates, role independence, frontend/backend coverage, handoffs, worktree boundaries, and audit trail are planned and checkable."
    },
    {
      "id": "ai-tool-governance-gate",
      "stage": "plan",
      "hardness": "detect_or_skip",
      "availability": "spec",
      "hook": "ai-tool-governance-gate.sh",
      "report": "walteur-kit/ai-tool-governance-report.json",
      "evidence": "AI tools, models, agents, MCP/plugin surfaces, data boundaries, approvals, output gates, cost controls, audit logs, and rollback controls are inventoried and approved before ship."
    },
    {
      "id": "authz-tenant-gate",
      "stage": "ship",
      "hardness": "detect_or_skip",
      "availability": "spec",
      "hook": "authz-tenant-gate.sh",
      "report": "walteur-kit/authz-tenant-report.json",
      "evidence": "Authorization and tenant-isolation surfaces prove deny-by-default decisions, role/permission coverage, negative access tests, anonymous denial, privilege-escalation prevention, audit logging, and signed local evidence before ship."
    },
    {
      "id": "privacy-data-gate",
      "stage": "ship",
      "hardness": "detect_or_skip",
      "availability": "spec",
      "hook": "privacy-data-gate.sh",
      "report": "walteur-kit/privacy-data-report.json",
      "evidence": "Personal, sensitive, regulated, or AI-context data surfaces prove inventory, purpose, minimization, lawful basis, retention, deletion/export paths, redacted logging, encryption, transfers, breach response, DPIA handling, tests, and signed local evidence before ship."
    },
    {
      "id": "sdlc-run-gate",
      "stage": "ship",
      "hardness": "detect_or_skip",
      "availability": "spec",
      "hook": "sdlc-run-gate.sh",
      "report": "walteur-kit/sdlc-run-report.json",
      "evidence": "Code-producing and deployable work proves local build, shared dev, staging, beta, production, independent review, QA, adversarial checks, rollback, monitoring, signoff, and retro evidence actually ran before ship."
    },
    {
      "id": "project-context-gate",
      "stage": "plan",
      "hardness": "detect_or_skip",
      "availability": "spec",
      "hook": "project-context-gate.sh",
      "report": "walteur-kit/project-context-report.json",
      "evidence": "Project-specific AGENTS/CLAUDE/rules context, context budget, baton, and subagent handoff refs are present and checkable."
    },
    {
      "id": "source-use-gate",
      "stage": "plan",
      "hardness": "detect_or_skip",
      "availability": "spec",
      "hook": "source-use-gate.sh",
      "report": "walteur-kit/source-use-report.json",
      "evidence": "Upstream source-router receipts prove source id, immutable pinned ref, extracted pattern, rejected parts, safety checks, artifact refs, verification, and rollback where needed."
    },
    {
      "id": "loop-workspace-gate",
      "stage": "intake",
      "hardness": "detect_or_skip",
      "availability": "spec",
      "hook": "loop-workspace-gate.sh",
      "report": "walteur-kit/loop-workspace-report.json",
      "evidence": "Loop workspace files, work-log grammar, signal/doc schemas, and domain-loop schema are present and checkable."
    },
    {
      "id": "self-improvement-gate",
      "stage": "plan",
      "hardness": "detect_or_skip",
      "availability": "spec",
      "hook": "self-improvement-gate.sh",
      "report": "walteur-kit/self-improvement-report.json",
      "evidence": "The run mines traces, scouts current GitHub sources, proposes bounded improvements, validates regressions, and captures compounding lessons."
    },
    {
      "id": "outcome-eval-gate",
      "stage": "review",
      "hardness": "detect_or_skip",
      "availability": "spec",
      "hook": "outcome-eval-gate.sh",
      "report": "walteur-kit/outcome-eval-report.json",
      "evidence": "An independent evaluator scores the delivered artifact against the requested outcome with rubric evidence, confidence, bias checks, and no blockers."
    },
    {
      "id": "qa-contract-gate",
      "stage": "verify",
      "hardness": "detect_or_skip",
      "availability": "spec",
      "hook": "qa-contract-gate.sh",
      "report": "walteur-kit/qa-contract-report.json",
      "evidence": "QA report proves unit/integration, functional, logic, integration, data integrity, security, and UX/resilience checks with fresh evidence."
    },
    {
      "id": "docrun",
      "stage": "verify",
      "hardness": "hard",
      "availability": "spec",
      "hook": "docrun.sh",
      "report": "walteur-kit/docrun-report.json",
      "evidence": "Documented shell blocks parse cleanly or are intentionally skipped."
    },
    {
      "id": "spec-lint",
      "stage": "plan",
      "hardness": "hard",
      "availability": "spec",
      "hook": "spec-lint.sh",
      "report": "walteur-kit/spec-lint-report.json",
      "evidence": "Plan and specification shape pass lint."
    },
    {
      "id": "spec-trace",
      "stage": "plan",
      "hardness": "hard",
      "availability": "spec",
      "hook": "spec-trace.sh",
      "report": "walteur-kit/spec-trace-report.json",
      "evidence": "Stories, requirements, and tasks trace across plan artifacts."
    },
    {
      "id": "prd-gate",
      "stage": "discover",
      "hardness": "detect_or_skip",
      "availability": "spec",
      "hook": "prd-gate.sh",
      "report": "walteur-kit/prd-gate-report.json",
      "evidence": "Product signal has a non-stub PRD or is explicitly not applicable."
    },
    {
      "id": "benchmark-gate",
      "stage": "discover",
      "hardness": "detect_or_skip",
      "availability": "spec",
      "hook": "benchmark-gate.sh",
      "report": "walteur-kit/benchmark-gate-report.json",
      "evidence": "User-facing product signal has a dated best-in-class benchmark or is explicitly not applicable."
    },
    {